{
  "type": "run.started",
  "event_id": "00000000-0000-0000-0000-000000000011",
  "payload_version": 1,
  "run_id": "00000000-0000-0000-0000-000000000010",
  "thread_id": "00000000-0000-0000-0000-000000000001",
  "sequence": 1,
  "timestamp": "2026-08-25T02:00:01Z",
  "payload": {"status": "running", "attempt": 1}
}
