{
  "type": "block.delta",
  "event_id": "00000000-0000-0000-0000-000000000012",
  "payload_version": 1,
  "run_id": "00000000-0000-0000-0000-000000000010",
  "thread_id": "00000000-0000-0000-0000-000000000001",
  "sequence": 2,
  "timestamp": "2026-08-25T02:00:02Z",
  "payload": {"message_id": 1002, "block_id": "00000000-0000-0000-0000-000000000101", "revision": 1, "delta": "你好", "content_type": "text/markdown"}
}
