{
  "type": "tool.call.started",
  "event_id": "00000000-0000-0000-0000-000000000022",
  "payload_version": 1,
  "run_id": "00000000-0000-0000-0000-000000000010",
  "thread_id": "00000000-0000-0000-0000-000000000001",
  "sequence": 10,
  "timestamp": "2026-08-25T02:00:10Z",
  "payload": {
    "tool_call_id": "call_p4_01",
    "status": "running",
    "revision": 2,
    "started_at": "2026-08-25T02:00:10Z"
  }
}
